keyword,title,description,originallink,link,pubDate
상일식품,[단독] 없어서 못 파는 CU 히트상품 '곰표 팝콘'서 곰팡이가?,최초 신고일로 부터 5일 후 제조사인 상일식품 관계자와 연결 됐으며 이 관계자는 A씨 자택에 직접 방문해 제품을 회수해갔고 검사 후 결과를 공유하기로 했다고. A씨는 당시 상황을 전하면서 제품 제조공정에서... ,http://www.sisafocus.co.kr/news/articleView.html?idxno=251005,http://www.sisafocus.co.kr/news/articleView.html?idxno=251005,"Fri, 20 Nov 2020 19:22:00 +0900"
민속주안동소주,"[박순욱의 술기행](38) “조선 3대 명주, 이강주가 확 달라졌어요","우리 말고도 한산소곡주 같은 약주도 면허를 받았지만 ‘전국 판매'가 허용된 술은 이강주, 문배술, 안동소주 셋뿐이다. 약주는 생산지 도내에서만 판매가 허용됐다. 원래는 88올림픽 때 대한민국을 대표할 민속주... ",https://biz.chosun.com/site/data/html_dir/2020/11/12/2020111200901.html?utm_source=naver&utm_medium=original&utm_campaign=biz,https://news.naver.com/main/read.nhn?mode=LSD&mid=sec&sid1=101&oid=366&aid=0000618389,"Thu, 12 Nov 2020 10:06:00 +0900"
종근당건강,"종근당건강 프로메가, ‘오메가3’ 전 라인업 패키지 리뉴얼","종근당건강이 ‘프로메가’의 새로운 브랜드 로고와 함께 전 제품 패키지를 전격 리뉴얼했다. 프로메가의 브랜드 로고는 혈행건강의 의미를 심볼릭화하여 상징적으로 표현, 오메가3 기능성을 직관적으로 표현한 것이... ",https://www.hankyung.com/economy/article/202011202152a,https://news.naver.com/main/read.nhn?mode=LSD&mid=sec&sid1=101&oid=015&aid=0004453373,"Fri, 20 Nov 2020 14:43:00 +0900"
로터스,보스톤 사이언티픽 로터스 TAVR 발 빼,"보스톤 사이언티픽이 세계적으로 로터스 엣지 경피적 대동맥판막 치환 시스템의 자발적 회수를 결정했다. 이에 따라 세계에서 모든 미이용 로터스 엣지 판막 재고는 즉시 회수되며 관련 마케팅, 제조, RD 활동도 전면... ",http://www.bosa.co.kr/news/articleView.html?idxno=2138349,http://www.bosa.co.kr/news/articleView.html?idxno=2138349,"Wed, 18 Nov 2020 14:41:00 +0900"
동성식품사,[이춘호 기자의 푸드 블로그] 매콤·달콤·맵달의 중독 '대구 3대 떡볶이',동성로 '중떡' 신내당시장 '달떡'체인점·분점 없이 한자리 고수하는 '중떡'쌀떡에 카레가루 섞어 매운맛... ◆떡볶이 유래식품사 연구가 황광해씨가 떡볶이 유래를 잘 정리해 놓았다. 그에 따르면 떡볶이에 대한 가장... ,//www.yeongnam.com/web/view.php?key=20200117010002236,//www.yeongnam.com/web/view.php?key=20200117010002236,"Fri, 17 Jan 2020 09:08:00 +0900"
강원인삼협동조합,집중 호우에 강원 인삼밭 축구장 80배 면적 피해,"11일 강원인삼협동조합에 따르면 이날까지 8개 시군 내 93개 농가에서 인삼밭 58.7㏊가 잠기거나 매몰, 유실되는 피해를 본 것으로 집계됐다. 이는 축구장(0.73㏊) 80개를 합친 면적보다 넓다. 이중 철원이 19.6㏊로 가장... ",http://yna.kr/AKR20200811094100062?did=1195m,https://news.naver.com/main/read.nhn?mode=LSD&mid=sec&sid1=102&oid=001&aid=0011807006,"Tue, 11 Aug 2020 13:48:00 +0900"
진주식품,[여기는 진주] 확진 잇따르는데 마스크 없이 윷놀이 도박,"경남 서부권 소식, 진주 스튜디오에서 안유리 아나운서가 전해드립니다. [답변] 진주 도심 공원에서 고령의... 농림축산식품부는 지난 16일 사천만에서 채취한 야생조류 분변에서 H5형 AI 항원이 검출됐다고 밝혔습니다.... ",http://news.kbs.co.kr/news/view.do?ncd=5052229&amp;ref=A,https://news.naver.com/main/read.nhn?mode=LSD&mid=sec&sid1=102&oid=056&aid=0010937470,"Thu, 19 Nov 2020 19:49:00 +0900"
국민제염,‘인삼 재배와 약용문화’ 이제서야 국가무형문화재 됐다…보유자는 온 국민,"무형기능 보유자는 따로 지정하지 않은 셈인데, 생활문화이니 전 국민이라고 봐도 된다. 지정된 내용은... (제133호), 제염(제134호), 온돌문화(제135호), 장 담그기(제137호), 전통어로방식–어살(제138-1호), 활쏘기(제142호) 등... ",http://news.heraldcorp.com/view.php?ud=20201121000052,https://news.naver.com/main/read.nhn?mode=LSD&mid=sec&sid1=103&oid=016&aid=0001755078,"Sat, 21 Nov 2020 11:54:00 +0900"
다이어트캠프,"[RE:TV] '위대한 배태랑' 김용만→김호중, 캠프파이어 통해 속마음 고백","'위대한 배태랑'이 캠프파이어를 통해 속마음을 고백했다. 지난 14일 오후 11시에 방송된 JTBC 예능프로그램... 한편, JTBC 예능프로그램 '위대한 배태랑'은 일명 '배·태(太)·랑(郞)'들의 신개념 다이어트 버라이어티... ",https://www.news1.kr/articles/?4058430,https://news.naver.com/main/read.nhn?mode=LSD&mid=sec&sid1=106&oid=421&aid=0004870940,"Tue, 15 Sep 2020 05:30:00 +0900"
명승제과,단양 대강면 명승 피서지 '인기만발',"ⓒ편집부 [충청일보] 한 여름 땡볕 더위가 이어지는 가운데 단양군 대강면의 명승 피서지에 주민서비스가... 이날 행사에는 주민자치센터의 제과제빵반의 제빵 나눠주기, 사인암리 주민들의 수박과 음료 제공 등 피서지... ",http://www.ccdailynews.com/sub_read.html?uid=285836&section=sc6,http://www.ccdailynews.com/sub_read.html?uid=285836&section=sc6,"Sun, 12 Aug 2012 23:28:00 +0900"
복음자리,대상FB 복음자리 신제품 선봬,"대상FB 복음자리가 향긋한 꽃과 허브, 새콤달콤한 과일을 함께 담아 언제 어디서나 간편하게 즐길 수 있는 블렌딩 차 제품 ‘티룸(TEAROOM)’ RTD 신제품 3종을 출시했다. 이번 신제품은 꽃, 허브, 과일의 맛과 향을 살려... ",http://www.bokuennews.com/news/article.html?no=197540,http://www.bokuennews.com/news/article.html?no=197540,"Sat, 21 Nov 2020 16:49:00 +0900"
일양약품,일양약품 백혈병치료제 `슈펙트`,국내서 전임상(동물) 시험 완료 일양약품은 러시아에서 코로나 19 치료제로 약물재창출 임상3상 시험중인 자사의 백혈병치료제 '슈펙트'에 대한 국내 전임상(동물) 시험을 완료했다고 16일 밝혔다. 이 회사는 2020년도... ,http://www.dt.co.kr/contents.html?article_no=2020111702101831102002&ref=naver,https://news.naver.com/main/read.nhn?mode=LSD&mid=sec&sid1=105&oid=029&aid=0002636976,"Mon, 16 Nov 2020 19:00:00 +0900"
광동제약,제약·바이오사 취업선호도 1위 ‘셀트리온’,"다음으로 2위는 ‘삼성바이오로직스(16.4%)’가 차지했고, ‘녹십자(15.7%)’와 ‘광동제약(15.4%)’은 근소한 차이로 3, 4위에 올랐다. 이외에는 △유한양행(10.5%) △종근당(9.3%) △SK바이오팜(7.2%) △한미약품(5.3... ",http://www.fnnews.com/news/202011190927336128,https://news.naver.com/main/read.nhn?mode=LSD&mid=sec&sid1=101&oid=014&aid=0004531585,"Thu, 19 Nov 2020 09:31:00 +0900"
보령제약,"보령제약, 예산공장 항암제 생산라인 GMP 인증",보령제약은 식품의약품안전처로부터 예산 공장 항암주사제 생산시설에 대한 GMP(의약품 제조 및 품질 관리 기준) 적합 인증을 받았다고 18일 밝혔다. 작년 4월 준공된 예산공장은 지난 10월 내용고형제 GMP 인증을... ,http://www.newsis.com/view/?id=NISX20201118_0001237928&cID=13001&pID=13000,https://news.naver.com/main/read.nhn?mode=LSD&mid=sec&sid1=101&oid=003&aid=0010191594,"Wed, 18 Nov 2020 09:38:00 +0900"
현대약품,"현대약품, 미에로화이바 1.2L 판매량 수직 상승",현대약품은 지난 8월 새롭게 출시한 미에로화이바 1.2L 제품 판매량이 수직 상승했다고 17일 밝혔다. 현대약품 측에 따르면 미에로화이바 1.2L 제품의 판매량이 기존 1.5L 제품의 전년도 동기간 판매량 대비 3배 이상 높은... ,http://medipana.com/news/news_viewer.asp?NewsNum=265973&MainKind=A&NewsKind=5&vCount=12&vKind=1,http://medipana.com/news/news_viewer.asp?NewsNum=265973&MainKind=A&NewsKind=5&vCount=12&vKind=1,"Tue, 17 Nov 2020 11:16:00 +0900"
삼성제약,"제약, 매출도 자본도 '빚'도 늘었다?","이어 부광약품이 90.6%, 삼성제약이 83.7%, CMG제약이 63.8%, SK바이오사이언스 54.1%, 테라젠이텍스 52.6% 등으로 전년 대비 50% 이상의 총부채가 늘어났다. 반면 우리들제약, JW신약, 한국유니온제약은 34%, 화일약품은 33... ",https://www.kpanews.co.kr/article/show.asp?idx=217840&category=D,https://www.kpanews.co.kr/article/show.asp?idx=217840&category=D,"Fri, 20 Nov 2020 06:26:00 +0900"
영진약품주식회사,"[실적속보] (잠정) 영진약품(별도), 2020/1Q 영업이익 24.79억원","6%-30293517순이익률3%-6%5%6%3% 기업개요 영진약품주식회사는 주로 의약품의 제조 및 판매를 영위하는 한국기반 회사입니다. 회사는 주로 항생제, 호흡기용약, 항감염약, 해열제, 진통제, 중추신경계용약... ",http://www.fntimes.com/html/view.php?ud=2020051309510952945dfa8ebf78_18,http://www.fntimes.com/html/view.php?ud=2020051309510952945dfa8ebf78_18,"Wed, 13 May 2020 09:52:00 +0900"
동아제약,"동아제약, 미니막스 정글·모닝케어 '2020 굿디자인 어워드'",동아제약은 미니막스 정글과 모닝케어가 ‘2020 굿디자인 어워드’에서 각각 한국디자인진흥원장상과 본상을 받았다고 20일 밝혔다. 굿디자인 어워드는 산업통상자원부가 주최하고 한국디자인진흥원이 주관하는 국내... ,http://www.inews24.com/view/1318897,https://news.naver.com/main/read.nhn?mode=LSD&mid=sec&sid1=101&oid=031&aid=0000569507,"Fri, 20 Nov 2020 10:13:00 +0900"
고려은단,"고려은단헬스케어, GS홈쇼핑서 ‘고려은단 면역비타민’ 단독구성 선봬",고려은단헬스케어가 18일 GS홈쇼핑을 통해 ‘고려은단 면역비타민’을 단독구성으로 선보인다. 이번 홈쇼핑을 통해 선보이는 ‘고려은단 면역비타민’은 바쁜 일상 속에서 간편하게 면역력을 챙길 수 있는 제품으로... ,https://sports.donga.com/article/all/20201116/103987274/1,https://news.naver.com/main/read.nhn?mode=LSD&mid=sec&sid1=101&oid=382&aid=0000871184,"Mon, 16 Nov 2020 10:48:00 +0900"
동화약품,"동화약품, '활명 스토어' 홍콩 디자인 어워드 동상","동화약품은 스킨케어 브랜드 ‘활명’의 국내 첫 플래그십 스토어가 홍콩 ‘디자인 포 아시아 어워드(Design for Asia Award, 이하 DFA어워드) 2020’에서 동상을 수상했다고 12일 밝혔다. DFA 어워드는 홍콩디자인센터가... ",http://www.newsis.com/view/?id=NISX20201112_0001232298&cID=13001&pID=13000,https://news.naver.com/main/read.nhn?mode=LSD&mid=sec&sid1=101&oid=003&aid=0010182650,"Thu, 12 Nov 2020 17:45:00 +0900"
일동제약,"일동제약 비오비타ㆍ지큐랩ㆍ미니멀레시피, '굿디자인'에 선정","일동제약은 비오비타, 지큐랩, 미니멀레시피가 '우수 디자인(굿디자인) 상품'으로 선정됐다고 18일 밝혔다. '우수 디자인 상품 선정'은 산업통상자원부와 한국디자인진흥원이 각각 주최ㆍ주관해 디자인이 우수한 상품과... ",http://www.fnnews.com/news/202011181552069445,https://news.naver.com/main/read.nhn?mode=LSD&mid=sec&sid1=103&oid=014&aid=0004531188,"Wed, 18 Nov 2020 16:05:00 +0900"
동성제약,동성제약-초록우산어린이재단 장학금 전달식,초록우산어린이재단이 동성제약으로부터 제28회 송음학술재단 장학생을 지원하기 위한 학업 장려금 1천6백만 원을 전달받았다고 20일 밝혔다. 사진은 송음학술재단 장학금 전달식에 참석한 이형진... ,http://yna.kr/PYH20201120027500013?did=1196m,https://news.naver.com/main/read.nhn?mode=LSD&mid=sec&sid1=102&oid=001&aid=0012027881,"Fri, 20 Nov 2020 09:13:00 +0900"
녹십자,"GC녹십자, '제 1회 노발락 랜선 토크콘서트' 개최",GC녹십자는 오는 28일 프리미엄 분유 '노발락’의 제 1회 랜선 토크콘서트를 개최한다고 20일 밝혔다. 노발락은 GC녹십자가 국내에 독점 공급하고 있는 프랑스 직수입 분유이다. 이번 토크콘서트는 코로나19 팬데믹 상황을... ,http://www.inews24.com/view/1318901,https://news.naver.com/main/read.nhn?mode=LSD&mid=sec&sid1=101&oid=031&aid=0000569509,"Fri, 20 Nov 2020 10:18:00 +0900"
경남제약,경남제약 ASF 동물용 소독제 출시,"경남제약은 아프리카 돼지 열병(ASF) 전용 소독제 '박탄에스'를 출시한다고 12일 밝혔다. 박탄에스는 친환경 유기산 합성체로, 인체와 동물에 모두 안전하며 돼지나 소, 닭 등의 조류에 특화된 바이러스를 소독하는... ",https://www.ebn.co.kr/news/view/1454164/?sc=Naver,https://www.ebn.co.kr/news/view/1454164/?sc=Naver,"Mon, 12 Oct 2020 16:58:00 +0900"
한국오츠카제약,"한국오츠카, '이너시그널' 무상 제공 체험단 500인 모집",한국오츠카제약(대표 문성호)은 29일까지 미백 주름 기능성 여성 화장품 브랜드 이너시그널 출시를 기념해 '턴오버 미백/안티에이징 이너시그널 체험단'을 모집한다. 이번 체험단은 피부의 겉이 아닌 피부 턴오버... ,http://www.womennews.co.kr/news/articleView.html?idxno=204124,https://news.naver.com/main/read.nhn?mode=LSD&mid=sec&sid1=101&oid=310&aid=0000081909,"Wed, 18 Nov 2020 20:30:00 +0900"
사노피-아벤티스코리아,"사노피 아벤티스, ‘멀택정’ 국내 허가 10주년 온라인 심포지엄 개최",［메디컬투데이 김준수 기자］ 글로벌 헬스케어 기업 사노피(Sanofi)의 국내 제약사업부문인 사노피-아벤티스 코리아는 심방세동 치료제 ‘멀택®정(성분명: 드로네다론염산염)’의 국내 허가 10주년을 기념해 이달... ,http://www.mdtoday.co.kr/mdtoday/index.html?no=405919,http://www.mdtoday.co.kr/mdtoday/index.html?no=405919,"Mon, 16 Nov 2020 09:30:00 +0900"
주식회사한독,"김천시, 내고장 탑기업 (주)한독 선정","김천시는 올해 내고장 탑기업으로 주식회사 한독을 선정했다고 밝혔습니다. 한독은 미용티슈와 부직포 등을 전문적으로 생산하는 기업으로, 품질 혁신과 기술 개발을 통해 지역의 대표적인 친환경 우수기업으로 평가받고... ",http://bit.ly/2ttxI9L,http://bit.ly/2ttxI9L,"Tue, 17 Dec 2019 19:36:00 +0900"
동국제약,"동국제약, 사업 다각화 효과 톡톡…연매출 5000억 돌파 코앞",▲ 동국제약 본사 (사진=동국제약)[아시아타임즈=이지영 기자] 동국제약이 사업 다각화에 성공하며 연매출 5000억원대를 바라보고 있다. 19일 업계에 따르면 동국제약은 1968년 설립 이래 OTC(일반의약품)로 유명한... ,https://www.asiatime.co.kr/news/newsview.php?ncode=1065593630968005,https://www.asiatime.co.kr/news/newsview.php?ncode=1065593630968005,"Thu, 19 Nov 2020 15:51:00 +0900"
동구바이오제약,"동구바이오제약, '셀블룸' 홈쇼핑 첫 론칭 방송에 '완판' 기록","롯데홈쇼핑, 11월 14일 론칭 방송 '드래곤 리제너레이트 크림' 전체 매진 동구바이오제약의 3D 줄기세포 배양액 화장품 '셀블룸'이 지난 11월 14일 롯데홈쇼핑 론칭방송에서 전량 완판을 기록했다고 밝혔다. '셀블룸'은 론칭... ",http://www.leaders.kr/news/articleView.html?idxno=220222,http://www.leaders.kr/news/articleView.html?idxno=220222,"Mon, 16 Nov 2020 09:12:00 +0900"
아영에프비씨,[부음] 변기호(아영에프비씨 대표이사)씨 모친상,"▲변기석(자영업)ㆍ기호(아영에프비씨 대표)ㆍ미자ㆍ옥자의 모친상, 이문세(아영에프비씨 부회장)ㆍ김병용(미국 거주)의 빙모상, 김명남ㆍ강주희의 시모상 -일시 : 2016년 5월 9일 -빈소... ",http://biz.chosun.com/site/data/html_dir/2016/05/09/2016050902311.html,https://news.naver.com/main/read.nhn?mode=LSD&mid=sec&sid1=102&oid=366&aid=0000326540,"Mon, 09 May 2016 17:43:00 +0900"
메디센서,"LG전자, 탈모인 100명 'LG 프라엘 메디헤어' 쏜다",감지 센서’와 머리 둘레에 맞춰 제품 사이즈를 조절할 수 있도록 한 ‘밴드 조절 다이얼’은 제품을 올바르게 착용하고 사용할 수 있도록 도와준다. LG 프라엘 메디헤어는 식품의약품안전처로부터 의료용 레이저... ,https://biz.chosun.com/site/data/html_dir/2020/10/12/2020101200717.html?utm_source=naver&utm_medium=original&utm_campaign=biz,https://news.naver.com/main/read.nhn?mode=LSD&mid=sec&sid1=105&oid=366&aid=0000601485,"Mon, 12 Oct 2020 10:01:00 +0900"
푸르밀,"식음료업계, 연말연시 앞두고 의외의 '해장템' 인기","◇푸르밀 '88생초콜릿우유', 달달한 해장 아이템으로 인기 젊은층에게 의외로 인기있는 해장음료는 달달한... 푸르밀의 신제품 '88생초콜릿우유'는 진한 초코맛과 부드러운 우유가 더해진 프리미엄 초코우유다. 원유를 88... ",http://www.newsis.com/view/?id=NISX20201120_0001241258&cID=13001&pID=13000,https://news.naver.com/main/read.nhn?mode=LSD&mid=sec&sid1=101&oid=003&aid=0010198324,"Sat, 21 Nov 2020 06:00:00 +0900"
노바렉스,"노바렉스 주가 상승 전망, 건강기능식품시장 성장의 수혜 커져",노바렉스 주가가 높아질 것으로 예상됐다. 코로나19 확산으로 건강기능식품시장이 커지면서 수혜를 누릴 것으로 예상됐다. 생산공장 증설효과도 중장기적으로 나타날 것으로 전망됐다. 권석형 노바렉스 대표이사... ,http://www.businesspost.co.kr/BP?command=article_view&num=205268,http://www.businesspost.co.kr/BP?command=article_view&num=205268,"Fri, 20 Nov 2020 08:55:00 +0900"
성경식품,"조미김 업체 성경식품, 과자 회사 개미식품 인수","지분 100%, 400억원대 SPA 체결 국내 대표 조미김 제조 업체 성경식품이 과자 생산회사 개미식품을 인수하며 사업 다각화에 나선다. 6일 인수·합병(MA) 업계에 의하면 성경식품은 개미식품 인수에 관한 주식매매계약(SPA)... ",http://news.mk.co.kr/newsRead.php?no=1141844&year=2020,https://news.naver.com/main/read.nhn?mode=LSD&mid=sec&sid1=101&oid=009&aid=0004690324,"Fri, 06 Nov 2020 15:01:00 +0900"
천우식품제조장,"'못 믿을' 후추·계피·큐민 분말, '쇳가루' 기준치 최대 18배 초과",문제가 된 제품은 Δ대상유통 베스트코 순후추 Δ우리승진식품 아주존 순 흑후추 Δ참두리 후추분말 Δ천우식품제조장 천우 순후추 Δ영흥식품 계피가루 Δ이에스기술연구소 계피분말 Δ일이삼유통 계피가루 Δ청우F2... ,https://www.news1.kr/articles/?4001686,https://news.naver.com/main/read.nhn?mode=LSD&mid=sec&sid1=101&oid=421&aid=0004767119,"Tue, 21 Jul 2020 12:00:00 +0900"
푸른들농산,'오늘은 농업인의 날'… 지역 농산물 소비 촉진 지원 나선 유통가,소비자들도 '착한 소비'로 부응하며 농산품 판매 촉진에 힘을 보태고 있다. CJ제일제당(097950)은 지역 농가... 상추 겉절이로 국립공원의 푸른 이미지를 구현했다. 국립공원 방문 2~3일 전에 도시락을 예약하면 탐방로 입구... ,https://biz.chosun.com/site/data/html_dir/2020/11/11/2020111101039.html?utm_source=naver&utm_medium=original&utm_campaign=biz,https://news.naver.com/main/read.nhn?mode=LSD&mid=sec&sid1=101&oid=366&aid=0000617727,"Wed, 11 Nov 2020 11:01:00 +0900"
신아상사,"'창립 30돌' NH농협무역, 글로벌 농식품 무역상사로 '도약'",전문무역상사로 더욱 도약하겠다는 의지를 다졌다. 이날 농협 서울지역본부 2층 대강당에서 열린... 없이 안심하고 농사짓는 ‘農TOPIA(농토피아)’를 이룰 수 있도록 최선을 다해주기 바란다”고 당부했다. [신아일보],http://www.shinailbo.co.kr/news/articleView.html?idxno=1289517,http://www.shinailbo.co.kr/news/articleView.html?idxno=1289517,"Tue, 16 Jun 2020 15:59:00 +0900"
동광상사,"방탄소년단 작곡가 '피독', 올해 국세청 모범납세자 선정후보로 올랐다","남문종합상사 대표 고상흥 : 장기간 성실납세로 국가재정 확보 및 납세의식 제고에 앞장서며, 사회공헌을... 있음 △ 동광해운 주식회사 대표 김경호 : 근로자 복지향상을 통한 노사관계 형성에 모범이 되고 있으며... ",http://www.sejungilbo.com/news/articleView.html?idxno=19971,http://www.sejungilbo.com/news/articleView.html?idxno=19971,"Thu, 30 Jan 2020 10:32:00 +0900"
대왕,논산 '대왕딸기' 킹스베리 조기 출하…내년에는 더 일찍,충남 논산지역 딸기 농가들이 특대종인 '킹스베리'를 조기 출하하기 시작했다. 20일 논산시농업기술센터에 따르면 지역 110여 농가는 지난 9월 초 킹스베리 묘를 심어 이달부터 수확에 들어갔다. 킹스베리는 달걀보다... ,http://yna.kr/AKR20201120119000063?did=1195m,https://news.naver.com/main/read.nhn?mode=LSD&mid=sec&sid1=102&oid=001&aid=0012029339,"Fri, 20 Nov 2020 16:05:00 +0900"
신라명과,"신라명과, 커피전문 브랜드 루소와 콜라보… '신라명과 더치 팩' 신제품 출시","제과제빵 전문 기업 신라명과에서 커피전문 브랜드 루소와 콜라보 하여 '신라명과 더치 팩'을 출시했다. '빵 굽는 사람들과 커피 볶는 사람들이 기획한 세상, 그 어떤 빵과도 가장 잘 어울리는 더치커피'를 모토로 출시된... ",https://www.dailysecu.com/news/articleView.html?idxno=116996,https://www.dailysecu.com/news/articleView.html?idxno=116996,"Fri, 20 Nov 2020 17:00:00 +0900"
금양인터내셔날,"'와인업계 1위' 금양인터내셔날, 까뮤이앤씨에 매각",금양인터내셔날 와인 © News1  국내 1위 와인 수입 업체인 금양인터내셔날의 주인이 건설 업체 까뮤이앤씨로 바뀐다. 14일 업계에 따르면 금양인터내셔날은 지난 6월 까뮤이앤씨 관계사인 베이스에이치디와... ,http://news1.kr/articles/?3100859,https://news.naver.com/main/read.nhn?mode=LSD&mid=sec&sid1=101&oid=421&aid=0002943208,"Thu, 14 Sep 2017 08:41:00 +0900"
대주웰빙푸드,웰빙엑스포 한달 앞 준비 순조,"K-푸드 요리교실을 열어 웰빙 한식류와 퓨전요리를 직접 요리하는 기회도 제공하며, 치즈 만들기 체험과... 외국전통문화체험을 수시로 진행하고, 사찰음식체험, 와이너리 체험, 전통식품 체험, 5대양 6대주... ",http://www.ccdailynews.com/sub_read.html?uid=350582&section=sc7,http://www.ccdailynews.com/sub_read.html?uid=350582&section=sc7,"Tue, 30 Jul 2013 23:42:00 +0900"
대전충남양계축산업협동조합,대전·세종·충남 조합장 당선자 181명 확정,윤노순 ▲대전충남양계축산업협동조합 임상덕 ▲대전충남양돈축산업협동조합 이제만 ▲천안축산업협동조합 정문영 ▲천안시산림조합 유병갑(무투표 당선) ◇공주시 ▲계룡농업협동조합 유영근 ▲공주농업협동조합... ,http://www.chungnamilbo.com/news/articleView.html?idxno=488121,http://www.chungnamilbo.com/news/articleView.html?idxno=488121,"Thu, 14 Mar 2019 20:04:00 +0900"
보원식품,식약청 ‘건강기능식품’ 통합 관리,식품의약품안전청이 내년부터 건강기능식품 관리를 식품인정보원을 통해 통합 관리한다. 식약청은 오늘(28일) 건강기능식품 부작용을 체계적으로 관리하기 위해 내년부터 식품안전정보원이 건강기능식품 부작용... ,http://www.khan.co.kr/kh_news/art_view.html?artid=201212281022302&code=900303,https://news.naver.com/main/read.nhn?mode=LSD&mid=sec&sid1=103&oid=032&aid=0002289124,"Fri, 28 Dec 2012 10:27:00 +0900"
산청군농업협동조합,산청 도라지 등 항노화산업박람회서 인기 경남생약협동조합 항노화 제품 전시...,"특히 경남생약농업협동조합에서도 홍보에 참여, 면역력 강화에 도움이 되는 백도라지, 도라지차 등 우수한 항노화 가공식품의 시음회와 판매행사를 진행해 방문객들의 호응을 얻었다. 산청군은 앞으로도 박람회 등... ",http://www.weeklytoday.com/news/articleView.html?idxno=324795,http://www.weeklytoday.com/news/articleView.html?idxno=324795,"Fri, 20 Nov 2020 15:25:00 +0900"
봄가을식품,"‘철도여행 + 명품전통식품’, 국내 관광 새장 연다","특히 ‘농가명품빌리지’는 다양한 농촌체험과 명인의 전통식품, 인근 지역 명소 관광을 창조적으로 접목함으로써 봄가을 관광주간 가족여행객에게 큰 인기를 끌 것이란 기대다. 최연혜 코레일 사장은 “철도를... ",http://biz.heraldcorp.com/view.php?ud=20140206001005,https://news.naver.com/main/read.nhn?mode=LSD&mid=sec&sid1=103&oid=112&aid=0002521894,"Thu, 06 Feb 2014 14:18:00 +0900"
한산소곡주,[休]67가지 '한산 소곡주' 맛보고 빚어보고···'술 익는 향기'에 취해볼까,"현재 서천한산소곡주영농조합에는 67개 양조장이 등록돼 있다. 하지만 명절 차례주나 선물용으로 술을 빚는 곳까지 합하면 실제로는 300여곳에 달한다고 한다. 지역 내 무형문화재 보유자가 있지만 대부분 가정에서 1,000년... ",https://www.sedaily.com/NewsView/1Z97EAUJ3L,https://news.naver.com/main/read.nhn?mode=LSD&mid=sec&sid1=103&oid=011&aid=0003813672,"Tue, 20 Oct 2020 17:16:00 +0900"
