keyword,title,description,originallink,link,pubDate
김해주조장,[Who Is ?] 장재영 신세계인터내셔날 대표이사 사장,"장재영은 2016년에 강남점 증축(2월), 부산 센텀시티몰 증축(3월), 시내면세점(5월), 김해점 개점(6월), 하남점... 중소 주조장과의 동반성장을 위한 업무협약을 체결한 뒤 악수하고 있다. 연합뉴스 1984년 신세계에... ",http://www.businesspost.co.kr/BP?command=article_view&num=205096,http://www.businesspost.co.kr/BP?command=article_view&num=205096,"Thu, 19 Nov 2020 10:21:00 +0900"
경보식품,"청소년 커피 중독 ‘경보’… 카푸치노 1잔, 1일 카페인 권장량 ‘2배’",식품의약품안전처가 권고한 청소년(14~19세) 1일 카페인 최대 섭취량은 몸무게 1㎏당 2.5㎎ 이하다.... 2013년 식품의약품안전처는 1㎖당 카페인이 0.15㎎ 이상 함유된 음료에 ‘고카페인 제품’ ‘어린이·임산부·카페인... ,https://shindonga.donga.com/3/all/13/2236174/1,https://news.naver.com/main/read.nhn?mode=LSD&mid=sec&sid1=102&oid=262&aid=0000013935,"Mon, 09 Nov 2020 10:17:00 +0900"
계촌양조장,[핫 이사람]“평창동계올림픽처럼 전 세계인 기억에 남는 수제맥주 만들고 싶...,"아내 수진씨 만나 2012년 평창에 정착 친구집서 우연히 맛본 수제맥주에 매료 양조장 겸 바 작년 방림면 계촌리 오픈 지난해 매출 1억4,000만원 빠른 성장세 “평창은 맥주를 만들기에는 완벽한 조건을 가지고 있습니다.... ",http://www.kwnews.co.kr/nview.asp?aid=220060400068,https://news.naver.com/main/read.nhn?mode=LSD&mid=sec&sid1=102&oid=087&aid=0000801660,"Fri, 05 Jun 2020 05:22:00 +0900"
영일식품,로또 937회 1등 배출점 서울 영등포구 당산로 '영일식품' 등 11곳,동행복권은 14일 추첨된 로또복권 제937회 1등 당첨자 배출 복권방이 서울 영등포구 당산로 '영일식품' 등 11곳이라고 공개했다. 20억5천만원씩을 받게되는 1등 당첨자 배출점은 서울이 송파구 올림픽로 '잠실매점... ,https://news.imaeil.com/Economy/2020111422063089718,https://news.naver.com/main/read.nhn?mode=LSD&mid=sec&sid1=101&oid=088&aid=0000671865,"Sat, 14 Nov 2020 22:07:00 +0900"
부안주조장,부안 ‘탄산 쌀막걸리’ 일본 첫수출,지난 21일 부안군 동진합동주조장(대표 정태식)은 일본으로 수출하는 〈탄산 동진 쌀막걸리〉와 〈탄산 부안 참뽕막걸리〉 15t을 첫 선적했다고 밝혔다. 수출 탄산쌀막걸리는 부안쌀과 오디를 원료로 사용해 제조했으며... ,http://www.nongmin.com/article/ar_detail.htm?ar_id=178388&subMenu=articletotal,http://www.nongmin.com/article/ar_detail.htm?ar_id=178388&subMenu=articletotal,"Mon, 30 Aug 2010 07:05:00 +0900"
새남해농업협동조합,"새남해농업협동조합, '우리 농수산물 구입 챌린지' 동참",남해군은 새남해농업협동조합이 코로나 19로 어려움에 처한 농가를 지원하기 위해 '우리 농수산물 구입 챌린지'에 참여했다고 28일 밝혔다. 지난주 남해지역건축사회가 참여한 이후 이번에는 새남해농협이 2백만원... ,http://www.weeklytoday.com/news/articleView.html?idxno=186035,http://www.weeklytoday.com/news/articleView.html?idxno=186035,"Thu, 28 May 2020 13:16:00 +0900"
삼호농산,"현대삼호重 이장협, 영암 금정면 대봉감 일손돕기",영암군 금정면(면장 이영주)은 12일 “최근 대봉감 수확기를 맞아 현대삼호중공업 사원아파트... 특히 산림청 지리표시제 제17호로 등록돼 농산물브랜드로서 우수성을 인정받고 있다. 하지만 올해는 냉해와 잦은 태풍으로... ,http://www.kjdaily.com/read.php3?aid=1605174102529954062,http://www.kjdaily.com/read.php3?aid=1605174102529954062,"Thu, 12 Nov 2020 18:58:00 +0900"
두원식품,"오리젠-아카나코리아, 구산동대형견쉼터에 반려동물식품 1톤 쾌척… 올 하반기...","한편, 두원실업㈜는 반려동물들의 영양과 기호를 고려하고 생물학적으로 적합한 식품인 오리젠과 아카나 제품을 국내에 선보이고 있다. 해당 제품은 사람이 먹어도 괜찮은 휴먼그레이드 등급으로 평가되고 있으며 이 밖에... ",http://www.mrepublic.co.kr/news/articleView.html?idxno=56772,http://www.mrepublic.co.kr/news/articleView.html?idxno=56772,"Tue, 17 Nov 2020 09:01:00 +0900"
에스엔에스인터내쇼날,[신설법인 현황] (2011년 1월26일~2012년 2월1일) 서울,이55호 ▷에스엔에스어소시에이츠(최성대·200·실내건축공사업) 강남구 청담동 21-14번지 3층... 에스지1020호 ▷태창인터내쇼날(최종태·50·산업용 화학제품 수출입업) 종로구 평창동 552-11번지 2층 ◇서비스... ,http://www.hankyung.com/news/app/newsview.php?aid=2012020306811,https://news.naver.com/main/read.nhn?mode=LSD&mid=sec&sid1=101&oid=015&aid=0002630313,"Fri, 03 Feb 2012 18:33:00 +0900"
성연식품,[식품이슈 돋보기] 원두커피에 허용 안된 '보존료' 첨가,충남 논산 소재 성연식품에서 제조한 과채음료 '하루채소과일'은 세균수 기준 규격 부적합으로 판매가 중단됐다. 유통기한이 오는 11월 19일까지인 제품이 회수 대상이다. 건강기능식품도 어김없이 이름을 올렸다. 전북... ,http://www.cstimes.com/news/articleView.html?idxno=429256,http://www.cstimes.com/news/articleView.html?idxno=429256,"Sun, 06 Sep 2020 09:12:00 +0900"
목포탁주합동제조장,"국세청, '납세자의 날' 포상 후보자 789명 공개","성신광고공사대표이사김중목포상후보자성실한 납세로 국가재정에 기여하고, 건전한 납세풍토를 조성한... 538서울탁주도봉연합제조장대표이상익포상후보자성실한 납세로 국가재정에 기여하고, 건전한 납세풍토를... ",http://www.joseilbo.com/news/news_read.php?uid=132930&class=7,https://news.naver.com/main/read.nhn?mode=LSD&mid=sec&sid1=101&oid=123&aid=0001979174,"Wed, 01 Feb 2012 11:33:00 +0900"
진도예향영농조합법인,"식약처, 유해물질인 검출된 진도 생산 주류 2종 회수","식품의약품안전처는 전남 진도에 있는 진도예향영농조합법인과 성원홍주가 각각 제조해 판매한 '진도예향홍주 60%', '리큐르주 성원홍주' 제품에서 가소제 성분인 디에틸헥실프탈레이트(DEHP)가 4∼7mg/kg 검출됨에... ",http://app.yonhapnews.co.kr/YNA/Basic/SNS/r.aspx?c=AKR20180202145300017&did=1195m,https://news.naver.com/main/read.nhn?mode=LSD&mid=sec&sid1=101&oid=001&aid=0009856095,"Fri, 02 Feb 2018 16:45:00 +0900"
정인식품,"김이나 정인 제아, 토크콘서트로 뭉친다 “열악한 환경거주 농촌주민 위해”",해당 토크콘서트는 코로나19 확산 방지를 위해 언택트로 진행되며 농림축산식품부 유튜브 '농러와TV'를 통해 생중계된다. 출연자 정인은 (김)이나 언니의 사회로 특별하고 의미있는 공연을 준비했어요. 오랜만에... ,https://www.newsen.com/news_view.php?uid=202011181506458010,https://news.naver.com/main/read.nhn?mode=LSD&mid=sec&sid1=106&oid=609&aid=0000358205,"Wed, 18 Nov 2020 15:19:00 +0900"
에덴식품영농조합법인,"고흥 에덴식품영농조합법인, 세계농업기술상 수상",전남 고흥군 에덴식품영농조합법인(대표 송재철)이 유자 수출에 기여한 공로를 인정받아 최근 한국프레스센터에서 '제25회 세계농업기술상' 수출 분야 우수상을 수상했다. 세계농업기술상은 1995년부터 농업발전에... ,http://www.joongdo.co.kr/main/view.php?key=20190827010009659,http://www.joongdo.co.kr/main/view.php?key=20190827010009659,"Mon, 26 Aug 2019 21:02:00 +0900"
녹선,[이도국의 영남좌도 역사산책] 영남선비들의 아름다운 '낙향',징비록을 완성하고 3년 뒤 세상을 떠나게 되는데 그동안 삭탈되었던 관직이 복관되고 청백리에 녹선되는 등 명예를 회복하게 된다. 선조의 여러 차례 부름에도 응하지 않고 학가산 기슭에 초막을 지어 머물면서 사람들이... ,https://www.yeongnam.com/web/view.php?key=20201120010000766,https://www.yeongnam.com/web/view.php?key=20201120010000766,"Fri, 20 Nov 2020 08:46:00 +0900"
한국코스모화장품,"메가랩, 코스모코스와 '더마 화장품 연구 개발·제조' MOU","▲ 마이크로바이옴 연구개발 기업인 메가랩은 화장품 업체인 코스모코스와 손잡고 더마 화장품 연구개발 및... 메가랩은 건국대와 한국의과학연구원, 한국행복미생물이 공동 출자해 설립한 마이크로바이옴 연구개발... ",http://yna.kr/AKR20201113065600848?did=1195m,https://news.naver.com/main/read.nhn?mode=LSD&mid=sec&sid1=101&oid=001&aid=0012012316,"Fri, 13 Nov 2020 11:30:00 +0900"
안동소주일품,"치즈향, 바닐라 풍미... 소주라고 다 같은 게 아닙니다","안동에는 안동소주를 만드는 제조장이 민속주 안동소주, 명인 안동소주, 로얄 안동소주, 안동소주 일품, 명품 안동소주, 회곡 안동소주, 안동소주 올소, 안동 진맥소주까지 해서 여덟 군데가 있다. 대구의 금복주도... ",http://www.ohmynews.com/NWS_Web/View/at_pg.aspx?CNTN_CD=A0002664122&CMPT_CD=P0010&utm_source=naver&utm_medium=newsearch&utm_campaign=naver_news,https://news.naver.com/main/read.nhn?mode=LSD&mid=sec&sid1=103&oid=047&aid=0002279536,"Wed, 05 Aug 2020 08:46:00 +0900"
에네프코리아,"[13일 낙찰/계약 동향] 도서관 환경개선공사 전자계약, 용현외 2지구 지하수이...","▲ 낙찰업체 : 에네프산업 주식회사, 계약금액 : 18,260,000(원), 계약명 : 용현외 2지구 지하수이용시설... ▲ 낙찰업체 : 주식회사 피엘테크코리아, 계약금액 : 176,260,000(원), 계약명 : 부흥관악단지 세대급수·급탕... ",http://www.fintechpost.co.kr/news/articleView.html?idxno=59330,http://www.fintechpost.co.kr/news/articleView.html?idxno=59330,"Tue, 13 Aug 2019 22:05:00 +0900"
아워홈,"[Consumer Journal] 김장, 긴장하지 마세요…`김장키트` 사면 되니까","아워홈은 1인, 2인 가구를 위해 절임배추, 김장키트 등을 판매하는 '아워홈 김장 기획전'을 12월 11일까지 진행한다. 아워홈 김장키트는 절임배추 10㎏과 중부식 김치양념 5.5㎏으로 구성됐다. 국내산 절임배추는 청정... ",http://news.mk.co.kr/newsRead.php?no=1189225&year=2020,https://news.naver.com/main/read.nhn?mode=LSD&mid=sec&sid1=101&oid=009&aid=0004698590,"Thu, 19 Nov 2020 04:03:00 +0900"
남신안농업협동조합,[동시조합장선거]전남 당선자 명단,(64) ▲남신안농업협동조합 김병남(60) ◇수협 ▲목포수산업협동조합 김청룡(55) ▲신안군수산업협동조합 김길동(63) ▲전남동부수산업협동조합 서광연(60) ▲전남정치망수산업협동조합 조선현(60) ▲제3... ,http://www.newsis.com/view/?id=NISX20190313_0000586766&cID=10899&pID=10800,https://news.naver.com/main/read.nhn?mode=LSD&mid=sec&sid1=102&oid=003&aid=0009112334,"Wed, 13 Mar 2019 23:05:00 +0900"
유림푸드,대전 유성구 로컬푸드 직거래 장터 행복팜 프리마켓,로컬푸드 직거래 장터인 행복팜 프리마켓은 해마다 40여 개 지역 농가가 참여해 유림공원 등에서 개최했으나 올해는 구청 광장에서 버스킹 공연을 겸한 워킹스루 장터와 온라인 친환경 농산물 꾸러미 100개 한정 판매... ,https://tjmbc.co.kr/article/Ke2ojqrg4c5m,https://tjmbc.co.kr/article/Ke2ojqrg4c5m,"Fri, 30 Oct 2020 08:06:00 +0900"
강릉전통약과(한과),"[2019 코엑스 푸드위크] 선미한과, 전통 강릉한과와 약과쿠키 선보인다",선미한과는 오는 11월 20일(수)부터 23일(토)까지 4일간 삼성동 코엑스에서 열리는 '2019 코엑스 푸드위크(제14회 서울국제식품산업전)'에 참가해 전통 강릉한과와 디저트한과의 첫 번째 시리즈인 약과쿠키를 소개한다.... ,http://kr.aving.net/news/view.php?articleId=1539709&Branch_ID=kr&rssid=naver&mn_name=news,http://kr.aving.net/news/view.php?articleId=1539709&Branch_ID=kr&rssid=naver&mn_name=news,"Tue, 19 Nov 2019 11:54:00 +0900"
텃골영농조합법인,"캠시스, 철원 행복텃골마을·레즐러와 업무협약","(사진=캠시스)[이데일리 김정유 기자] 캠시스(050110)는 ‘스마트 그린빌리지 실증단지’내 친환경 이동수단 도입을 위해 강원도 철원군 영농조합법인(이하 행복텃골마을), 신재생에너지 발전업체 레즐러와 업무협약을... ",http://www.edaily.co.kr/news/newspath.asp?newsid=02236966619440816,https://news.naver.com/main/read.nhn?mode=LSD&mid=sec&sid1=101&oid=018&aid=0004277610,"Fri, 21 Dec 2018 10:54:00 +0900"
동주실업,"조병두 동주실업 회장, 성대 장학금 5억 쾌척",News1  조병두 동주실업 회장은 지난 7일 모교인 성균관대학교를 방문해 김준영 총장에게 장학기금으로 5억원을 전달했다고 학교측이 11일 밝혔다. 조 회장은 상학과 58학번 동문으로 1999년부터 모교에 5차례에... ,http://news1.kr/articles/929419,https://news.naver.com/main/read.nhn?mode=LSD&mid=sec&sid1=102&oid=421&aid=0000088655,"Tue, 11 Dec 2012 11:05:00 +0900"
진도아리랑영농조합법인,"이낙연 지사, 진도홍주 생산 현장 살펴","20일 진도홍주를 생산하는 대대로영농조합법인 사업장을 방문, 생산 현장을 둘러보고 수출국 다변화 등... 진도대복영농조합, 진도아리랑영농조합, 진도예향영농조합, 한샘영농조합, 성원홍주, 소달구지영농조합 등... ",http://www.nocutnews.co.kr/news/4771745,https://news.naver.com/main/read.nhn?mode=LSD&mid=sec&sid1=102&oid=079&aid=0002957768,"Thu, 20 Apr 2017 16:06:00 +0900"
농가사랑식품,"NH농협, 경남 고성서 ‘사랑의 집 고치기’ 봉사활동","21일 NH농협에 따르면 전날 오후 열린 행사에는 국민의힘 정점식 국회 농림축산식품해양수산위원회 위원(통영·고성), 손병환 NH농협은행장, 사랑의 집고치기 ‘농가희망봉사단’ 및 경남농협 봉사단원 등이 참석했다.... ",http://www.newsis.com/view/?id=NISX20201121_0001242181&cID=10812&pID=10800,https://news.naver.com/main/read.nhn?mode=LSD&mid=sec&sid1=102&oid=003&aid=0010198434,"Sat, 21 Nov 2020 10:49:00 +0900"
성포양조장,"유자를 만난 막걸리 맛은 경쾌, 향은 상큼",성포 양조장의 유자 막걸리 ‘유향’ 가장 먼저 찾은 곳은 통영과 가장 가까운 거리에 있는 성포 양조장이었다. 여러 경진대회에서 몇 차례나 수상을 하며 이미 그 맛을 인정받고 있는 이곳은 16년 전부터 막걸리를... ,http://sunday.joins.com/article/view.asp?aid=35055,https://news.naver.com/main/read.nhn?mode=LSD&mid=sec&sid1=103&oid=353&aid=0000019653,"Sun, 17 Aug 2014 04:10:00 +0900"
박신당한과,[출향 강원도민 한마음 대축제 이모저모]“이런 행사 왜 이제야 열렸나…강원...,"특히 강릉에서 4대째 전통 한과를 제조하고 있는 (주)명일은 꼬마 한과를, 3대째 이어온 제빵명가 박신당은 도내 농산물로 만든 쌀커피, 쌀빵 등을 선보여 인기몰이. 원주 쌀찐빵, 속초 명품 웰빙젓갈, 홍천 사과, 평창... ",http://www.kwnews.co.kr/view.asp?aid=219101300091&s=501,https://news.naver.com/main/read.nhn?mode=LSD&mid=sec&sid1=102&oid=087&aid=0000773218,"Mon, 14 Oct 2019 00:33:00 +0900"
이가자연면,유일하게 찾아온 이가 후배 김문수였어,"서로가 의식을 계발하던 시기, 자연스럽게 사회의식을 깨웠지. 그런 면에서 나는 굳이 나누자면... 그때 유일하게 찾아온 이가 후배 김문수였다. 71년 여름방학에 김문수를 비롯해 서울대 상대 써클 '이론경제학회'에서... ",http://www.ohmynews.com/NWS_Web/View/at_pg.aspx?CNTN_CD=A0002690968&CMPT_CD=P0010&utm_source=naver&utm_medium=newsearch&utm_campaign=naver_news,https://news.naver.com/main/read.nhn?mode=LSD&mid=sec&sid1=102&oid=047&aid=0002291960,"Mon, 16 Nov 2020 09:06:00 +0900"
한정성,"복고는 촌스럽고 지루하다? MZ세대 독특, '힙'함 그 자체","마케팅의 5대 원칙으로 한정성, 비밀스러움, 증폭, 재미, 속임수를 꼽고 있다. 공급을 제한함으로써 한정성을 갖고, 과거의 이야기를 들려주면서도 비밀이 존재하는 뜻 애태우며, 사람들의 입에 오르내려 입소문이 날 수... ",http://www.idaegu.co.kr/news/articleView.html?idxno=327905,http://www.idaegu.co.kr/news/articleView.html?idxno=327905,"Thu, 05 Nov 2020 21:56:00 +0900"
진주진양농업협동조합,[경남농협] 공공비축 건조벼 수매현장 찾아 농업인 격려 外,찾아 농업인 격려 경남농협(본부장 윤해진)은 13일 공공비축 건조벼 매입중인 진주진양농협(조합장 유호종)... 글로벌 협동조합 농협을 홍보했다. 특히 농협경제지주의 사업역량을 기반으로 생산·유통·가공 등... ,https://ilyo.co.kr/?ac=article_view&entry_id=384650,https://ilyo.co.kr/?ac=article_view&entry_id=384650,"Sat, 14 Nov 2020 09:38:00 +0900"
남한산성소주,[코로나19 OUT!]남한산성소주·성현유통 '참살이막걸리 수익금' 곤지암읍에 기...,"참살이 막걸리 생산업체인 남한산성소주와 유통업체인 성현유통은 10일 곤지암읍 행정복지센터를 방문, 이웃사랑 나눔을 실천하기 위해 참살이 막걸리 판매 수익금 801만8천550원을 기탁했다.기탁식에는 김영일... ",http://www.kyeongin.com/main/view.php?key=20200610010002444,http://www.kyeongin.com/main/view.php?key=20200610010002444,"Wed, 10 Jun 2020 23:20:00 +0900"
로투스베이커리즈코리아,‘로투스베이커리즈코리아’ 프리미엄 아이스크림 2종 출시,"‘로투스베이커리즈코리아’ 관계자는 “요즘 소비자들은 디저트를 선택할 때 좋은 재료를 이용했는지, 동물성 재료가 들어있지는 않은지 모두 따지곤 하는 데 이런 소비자 트렌드를 반영한 프리미엄 아이스크림을... ",https://www.seoul.co.kr/news/newsView.php?id=20200526500033&wlog_tag3=naver,https://news.naver.com/main/read.nhn?mode=LSD&mid=sec&sid1=004&oid=081&aid=0003093494,"Tue, 26 May 2020 10:56:00 +0900"
우영식품,"해수부, 민간에 수산가공식품 7종 기술 이전","한국식품연구원, 신라대학교 산학협력단 관계자들이 기술이전 대상기업인 대일씨에프, (주)덕화푸드, 여수새고막(주), (주)우영수산, (주)에바다수산, (주)해담온, (주)희창물산 관계자들과 기념사진을 찍고 있다.... ",http://www.dt.co.kr/contents.html?article_no=2018110402109958054004&ref=naver,https://news.naver.com/main/read.nhn?mode=LSD&mid=sec&sid1=101&oid=029&aid=0002490367,"Sun, 04 Nov 2018 14:28:00 +0900"
대례원,"대가야대례원, 4회 대가야왕릉 헌다례 및 가을차회 행사 개최","대가야다례원(원장 이영희)은 지난 16일 대가야 왕릉전시관 전정에서 관내 기관단체장 및 인근 차 동호인, 관광객 등 300여명이참석한 가운데 ‘제4회 대가야왕릉 헌다례 및 가을차회’행사를 개최했다. ▲ 제4회... ",http://www.breaknews.com/685462,http://www.breaknews.com/685462,"Thu, 17 Oct 2019 14:19:00 +0900"
현대소금,"마지막 복직 투쟁 '소금꽃' 김진숙, 암 재발한 것으로 알려져",대신 김 위원은 현대중공업 하청노동자인 변주현 씨에게 쓴 편지를 보내왔다. 편지는 정혜금 금속노조 부산양산지부 사무국장이 대신 읽었다. 김 위원은 민주노조를 함께 꿈꿨던 동지가 국가권력에 살해되고... ,https://www.pressian.com/pages/articles/2020111910424128274?utm_source=naver&utm_medium=search,https://news.naver.com/main/read.nhn?mode=LSD&mid=sec&sid1=102&oid=002&aid=0002159762,"Thu, 19 Nov 2020 10:53:00 +0900"
금왕양조영농조합법인,음성 햇사레 복숭아로 만든 '햇사레 와인' 시판,16일 군에 따르면 금왕읍 금왕양조영농조합법인(대표 조성민)은 최근 친환경농업으로 재배한 햇사레 황도복숭아를 원료로 해서 개발한 '햇사레 와인'을 시판하고 있다. 조 대표는 2대째 금왕에서 양조업을 하면서... ,,https://news.naver.com/main/read.nhn?mode=LSD&mid=sec&sid1=102&oid=003&aid=0002331117,"Thu, 16 Oct 2008 10:59:00 +0900"
안심탁주,안심하고 드세요 '전남도지사 품질인증' 농특산물 406개 선정,"선정된 제품은 곡성 '시향가 탁주', 강진 '참좋은된장', 무안 '맑은국양파장', 완도 '명품다시마장아찌' 등이다. 이들 제품은 오는 7월1일부터 2023년 6월30일까지 3년간 도지사 품질인증 통합상표를 포장재에 사용할 수... ",https://www.news1.kr/articles/?3975380,https://news.naver.com/main/read.nhn?mode=LSD&mid=sec&sid1=102&oid=421&aid=0004715325,"Wed, 24 Jun 2020 15:52:00 +0900"
고창고인돌복분자주영농조합법인,고창 복분자 와인 품평회…세계 수준급,이날 시음된 복분자 와인은 ▲고창명산품복분자주 ▲선운산복분자주흥진 ▲고창고인돌복분자주 ▲고창서해안복분자주 ▲선운산동백복분자주 ▲고창명품영농조합법인 선운당 ▲배산면주가 고창LB... ,,https://news.naver.com/main/read.nhn?mode=LSD&mid=sec&sid1=101&oid=003&aid=0003300740,"Mon, 21 Jun 2010 09:56:00 +0900"
대림종합식품,"사조대림, 에어프라이어 전용 '화이트 구슬치킨 · 찹쌀 꿔바로우' 출시",더 바삭하고 간편/깔끔하게 즐기 수 있어 간식 또는 술안주로 인기 예상 종합식품기업 사조대림은 에어프라이어 전용 브랜드 ‘FRYDAY(프라이데이)’의 신제품 ‘화이트 구슬치킨과 찹쌀 꿔바로우’를 새롭게 선보였다.... ,http://moneys.mt.co.kr/news/mwView.php?no=2020111108438090727,https://news.naver.com/main/read.nhn?mode=LSD&mid=sec&sid1=101&oid=417&aid=0000620561,"Wed, 18 Nov 2020 16:45:00 +0900"
농업회사법인아람농장,지난해 동물복지 축산농장 56개소 신규 인증,산란계 농업회사법인 ㈜동일농장 대소2지점 정혜선 충북 2018-12-03 193 산란계 비봉농장 전점숙 경북 2018-12-03 194 육계 아람농장 김상호 전북 2018-12-10 195 육계 소담농장 백세현 전북 2018-12-17 196... ,http://www.foodnews.co.kr/news/articleView.html?idxno=70869,http://www.foodnews.co.kr/news/articleView.html?idxno=70869,"Thu, 08 Aug 2019 11:15:00 +0900"
녹색영농조합법인,"경북도, 포항 동네언니협동조합 등 15곳 행안부 마을기업 최종 선정",이번에 신규로 선정된 마을기업은 중 일반 마을기업 5개소는 △포항시 동네 언니 협동조합 △경주시 약선새마을 게르마늄 관광레저학습단지 영농조합법인 △영주시 녹색농심인삼마을영농조합법인 △상주시... ,http://www.kyongbuk.co.kr/news/articleView.html?idxno=2045329,http://www.kyongbuk.co.kr/news/articleView.html?idxno=2045329,"Fri, 03 Jul 2020 00:10:00 +0900"
삼보식품,"코스피, 2500선 안착...'코리아센터-삼보산업-만호제강' 급등","이어서 인터넷과카탈로그소매, 식품, 창업투자, 화학, 포장재, 게임엔터테인먼트, 교육서비스 업종 등이 1... 코리아센터와 삼보산업이 각각 전장 거래일 최고치인 상한가를 터치하며 거래 중이다. 이어서 만호제강... ",http://www.betanews.net:8080/article/1241234.html,http://www.betanews.net:8080/article/1241234.html,"Wed, 18 Nov 2020 11:11:00 +0900"
솔거종합식품,"‘천년신라, 빛으로 살아나다' 경주세계문화엑스포 10월 개막(종합)","미디어아트) ▲솔거미술관 ‘문화로 여는 미래의 길’전 등이다. 체험 분야는 ▲전국 첫 맨발 전용 둘레 길... 행사 기간 경북국제식품박람회, 공예바자르, 경북예술제, 도자기 명인전, 세계시민으로 사는 경북인 2019도... ",http://www.newsis.com/view/?id=NISX20190917_0000771602&cID=10899&pID=10800,https://news.naver.com/main/read.nhn?mode=LSD&mid=sec&sid1=102&oid=003&aid=0009456626,"Tue, 17 Sep 2019 15:20:00 +0900"
코코식품,[200자 책꽂이] 코코 샤넬 외,"△코코샤넬(론다 개어릭│888쪽│을유문화사) 가브리엘 샤넬(1883~1971)은 생전 “나는 전 세계에 옷을... 대한제국 황실에 차려진 서양식 만찬에서부터 식민지 시기 일본 음식, 경제성장기 인스턴트 식품과 현재까지를 여섯... ",http://www.edaily.co.kr/news/newspath.asp?newsid=01423526625967032,https://news.naver.com/main/read.nhn?mode=LSD&mid=sec&sid1=103&oid=018&aid=0004788515,"Wed, 18 Nov 2020 06:03:00 +0900"
강원농수산,[이슈] 강원도의회 ‘강원도 문어낚시 금지 조례안’ 입법 예고 해프닝 임시회...,강원도의회‘강원도 문어낚시 금지 조례안’ 입법 예고 해프닝 임시회 상정 유보됐지만 불씨는 여전히 남아... 아울러 농수산분과위원회에서 법률 심사를 담당하는 소위원회에서 조차 “근거 자료가 없는데 어떻게... ,http://fish.darakwon.co.kr/newscolumn/newscolumn_view.asp?b_no=13788&code=n,http://fish.darakwon.co.kr/newscolumn/newscolumn_view.asp?b_no=13788&code=n,"Thu, 19 Nov 2020 08:07:00 +0900"
