keyword,title,description,originallink,link,pubDate
음성양조장,北에서 맥주 정도는 술 아닌 청량음료…부드럽게 취하는 北서민술 궁금하세요...,2009년 탈북해 지금은 충북 음성군에서 양조장 하나도가를 운영하고 있다. 가문의 술인 태좌주와 북한 서민들의 술인 농태기를 재현해 매일같이 술을 빚어내고 있다. 동시에 고등학생 딸을 키우며 기업가로서 꿈을... ,http://news.mk.co.kr/newsRead.php?no=1169206&year=2020,https://news.naver.com/main/read.nhn?mode=LSD&mid=sec&sid1=102&oid=009&aid=0004695219,"Fri, 13 Nov 2020 17:03:00 +0900"
신혜인식품,[뉴스앤이슈] 정치권 '전광훈' 불똥...대통령·여당 지지율 반등,"앞서 영상에서 보셨는데 보수 유튜버 신혜식 씨 병실에서 항의하는 모습 보셨죠? [이종근] 그렇습니다.... 농수산식품부에서는 농어촌 체험활동과 관련해서, 또 문체부에서는 공연이라든지 활동 관련해서. 외식하면 2만... ",https://www.ytn.co.kr/_ln/0101_202008211208161501,https://news.naver.com/main/read.nhn?mode=LSD&mid=sec&sid1=100&oid=052&aid=0001480825,"Fri, 21 Aug 2020 12:08:00 +0900"
농업회사법인 현농,구세군 여주 나눔의집 금사면서 ‘이동 푸드마켓’,"농업회사법인 현농, 썬밸리 아이앤티, 케이앤푸드, 먹거리나눔운동협의회 등이 식료품 및 화장품 등 15가지 물품들을 지원했다. 대부분 대상자가 면사무소를 직접 방문해 후원물품을 수령했으나 장애인, 고령 노인 등... ",http://www.kihoilbo.co.kr/?mod=news&act=articleView&idxno=687468,http://www.kihoilbo.co.kr/?mod=news&act=articleView&idxno=687468,"Tue, 28 Feb 2017 22:24:00 +0900"
구포국수,"[속보] 순천시 동선공개 남정동 아랫장호프, 아랫장 구포국수, 가곡동 제일반...",11.13.(금) 09:20~20:30 11.18.(수)~19.(목) 남정동 아랫장호프 방문자는 내일 보건소 선별검사 바랍니다. 11.12. 12:40~13:20 아랫장 구포국수 11.14. 12:50~13:30 가곡동 제일반점 방문자는 내일 보건소 선별검사 바랍니다.,http://www.asiaa.co.kr/news/articleView.html?idxno=7345,http://www.asiaa.co.kr/news/articleView.html?idxno=7345,"Sat, 21 Nov 2020 19:16:00 +0900"
농업회사법인조은술세종,부정경쟁 논란 휩싸인 '가덕막걸리',가덕에서 2대째 막걸리를 빚고 있는 청주양조 합자회사는 지난 7월 대청주조와 농업회사법인조은술세종 주식회사에 대해 부정경쟁방지법 위반으로 소송을 제기했다. 인지도와 시장 점유율이 높은 '가덕 막걸리'의 '가덕... ,http://www.jbnews.com/news/articleView.html?idxno=701956,http://www.jbnews.com/news/articleView.html?idxno=701956,"Fri, 11 Dec 2015 09:56:00 +0900"
영농조합법인제주다,"제주올레, 김탁환·이동현·홍진이 초청 강연","제주와 연결된 제품, 자연을 배려한 제품, 지역을 생각한 제품을 기준으로 '꽃마리협동조합'의 핸드솝, '인화로사회적협동조합'의 감 마스크, '영농조합법인 제주다'의 제주 조릿대차, 귤피소금, '파란공장'의... ",http://www.jejusori.net/news/articleView.html?idxno=322609,http://www.jejusori.net/news/articleView.html?idxno=322609,"Fri, 20 Nov 2020 09:45:00 +0900"
김천탁주합동제조장,[막걸리]대구경북 막걸리,황계 ▷김천탁주합동제조장 경북 김천 성내60-33 ▷용암탁주합동 경북 성주 용암 용정 ▷가천탁주합동양조장 경북 성주 가천 창천 ▷남면탁주합동 경북 김천 남 옥산 ▷감천양조장 경북 김천 감천 도평 ▷감문탁주합동... ,http://www.imaeil.com/sub_news/sub_news_view.php?news_id=33078&yy=2009,https://news.naver.com/main/read.nhn?mode=LSD&mid=sec&sid1=102&oid=088&aid=0000135373,"Fri, 24 Jul 2009 08:24:00 +0900"
푸드공방,"서울집' 송은이·정상훈, 푸드스타일 집 방문에 감탄…조정석·크러쉬 등이 다...",‘우리집’의 집주인은 10여 년 동안 다양한 분야에서 활동한 푸드스타일리스트로 직업적 특성상 여러 가지... 그 공간은 바로 목수 11년 차인 송은이도 아직 갖지 못한 거대한 사이즈의 목공방이었던 것. 송은이는 “일이... ,https://www.asiatoday.co.kr/view.php?key=20201118010012002,https://www.asiatoday.co.kr/view.php?key=20201118010012002,"Wed, 18 Nov 2020 22:51:00 +0900"
제주샘영농조합법인,이달의 농촌융복합산업인에 제주샘 김숙희 대표,"이달의 농촌융복합산업인에 '제주샘 영농조합법인' 김숙희 대표를 선정했다고 농림축산식품부가 14일 밝혔다. 제주샘은 지역 내 농가와 술의 주원료인 쌀, 좁쌀, 감귤 등을 계약재배하고 전통기법을 활용해 3대째... ",http://yna.kr/PYH20201014067100530?did=1196m,https://news.naver.com/main/read.nhn?mode=LSD&mid=sec&sid1=101&oid=001&aid=0011943857,"Wed, 14 Oct 2020 16:47:00 +0900"
한울제과,[friday] 한국빵 100년 빵신들의 수다,한국의 제과 제빵 역사라면 누구보다 꿰뚫는 빵의 달인들이 한국의 빵 얘기를 들려줬다. (작은 사진)대한민국 대표 빵집 9곳이 한울회라는 이름으로 뭉쳤다. 격월로 만나 친목을 다지고 정보를 교환해온 지 벌써 35년째다.... ,http://news.chosun.com/site/data/html_dir/2018/07/19/2018071901518.html?utm_source=naver&utm_medium=original&utm_campaign=news,https://news.naver.com/main/read.nhn?mode=LSD&mid=sec&sid1=103&oid=023&aid=0003388114,"Fri, 20 Jul 2018 03:03:00 +0900"
뉴그린,26년 장태산 사진작가의 정성이 담긴 수육쌈밥,"케일, 배추, 깻잎, 청겨자, 적겨자, 뉴그린, 치커리, 뉴그린, 쌈추 등 계절에 맞는 20여 가지의 무공해 신선한 쌈이 나온다. 갤러리 입구작품을 감상하는 손님 대전 유일 장태산사진작가 열정과 맛에 감동 전국에서 찾아... ",http://www.dtnews24.com/news/articleView.html?idxno=590951,http://www.dtnews24.com/news/articleView.html?idxno=590951,"Mon, 02 Nov 2020 09:48:00 +0900"
하늘처럼,"사고 이틀만에, 우리집 히어로 하늘로 6살 엄마 눈물의 청원",청와대 국민청원 게시판에 따르면 지난 13일 “놀다 친구와 부딪힌 사고로 우리 집의 6살 슈퍼히어로가 하늘나라로 출동했습니다. 어린이집 원아 대 담임 보육교사 인원 비율 및 야외놀이 시 인원 비율에 대한 법령 개정을... ,https://news.joins.com/article/olink/23521141,https://news.naver.com/main/read.nhn?mode=LSD&mid=sec&sid1=102&oid=025&aid=0003054272,"Sat, 21 Nov 2020 13:26:00 +0900"
지산물산,[시경Today-분양] 삼성물산·대림산업·HDC현산 '레이카운티' 8월 분양 外,삼성물산·대림산업·HDC현대산업개발이 부산 연제구 거제동 802번지 일원에 위치한 거제2구역을 재개발해... 대구 수성구 지산동 1234번지 일원에 들어서는 '더샵 수성라크에르'는 수성못 인근에 위치한... ,http://www.meconomynews.com/news/articleView.html?idxno=44205,http://www.meconomynews.com/news/articleView.html?idxno=44205,"Fri, 07 Aug 2020 17:14:00 +0900"
아이젠,[해외 등반] 이탈리아 돌로미테 비아 페라타 조반니 리펠라… 암벽에 새겨진 ...,초봄과 늦가을에는 트레킹용 아이젠을 꼭 가지고 가야 한다. 하산 정상에서 북동쪽 방향으로 내려간다.... 등산로에 눈이 많이 쌓였을 수 있으니 트레킹용 아이젠이 필수이다. 쥬사니 산장Rif. Giussani 피난처까지는... ,http://san.chosun.com/site/data/html_dir/2020/10/23/2020102302465.html?utm_source=naver&utm_medium=original&utm_campaign=san,https://news.naver.com/main/read.nhn?mode=LSD&mid=sec&sid1=103&oid=094&aid=0000008612,"Thu, 19 Nov 2020 09:39:00 +0900"
승우식품,“비교하면 욕심 끝없어…나이 들어 안 물러나는 건 헛짓”,"풀무원 유기식품은 제 개인회사였고, 건강식품은 저랑 승우가 공동대표를 맡았어요.”(원) 두 사람은 고교 때 같은 반 친구 원혜영은 민주화운동에 매진 남승우는 연애·놀기 등에 열중 1980년 우연한 운명적 만남 뒤... ",http://www.hani.co.kr/arti/politics/assembly/948160.html,https://news.naver.com/main/read.nhn?mode=LSD&mid=sec&sid1=100&oid=028&aid=0002500112,"Sat, 06 Jun 2020 07:08:00 +0900"
도야지식품,"신세계百, 식품관 VIP 고객 따로 뽑아 혜택","이 스마트 메시지를 받은 식품관 코어 고객은 문자 메시지를 받기 전보다 식품 장르에서 평균 2.7배 많은 금액을 지출했으며, 식품관을 방문하는 빈도도 1.8배가 늘었다. 얼룩도야지 요리 레시피에 곁들여 추천한 세... ",https://biz.chosun.com/site/data/html_dir/2020/04/06/2020040603475.html?utm_source=naver&utm_medium=original&utm_campaign=biz,https://news.naver.com/main/read.nhn?mode=LSD&mid=sec&sid1=101&oid=366&aid=0000504980,"Mon, 06 Apr 2020 18:08:00 +0900"
마니커에프앤지,"NS홈쇼핑, 토크쇼 V커머스 '사랑쇼' 첫 방송…마니커에프앤지 선봬","이날 첫 방송에는 '마니커에프앤지 신상품 세트'를 선보인다. 상품 기본 구성은 양념치킨 1봉과 바사삭치킨 1봉이다. 신상품 '바사삭닭다리', '옛날양념치킨', '빨간맛통다리' 3가지를 즐길 수 있는 추가 옵션 구성도 있다.... ",https://www.news1.kr/articles/?4113923,https://news.naver.com/main/read.nhn?mode=LSD&mid=sec&sid1=101&oid=421&aid=0004980550,"Tue, 10 Nov 2020 10:14:00 +0900"
농업회사법인명품안동소주,"명품안동소주, 한·러수교 30주년 코리아 페스티벌 공식선물 지정","전시· 판촉 행사에는 참조은 명품안동소주 16.9도를 비롯하여 탁촌장 국수제품, 류충현 약용버섯 액상차류, K푸드바이오 홍삼커피, 신비안농업회사법인 흑마늘, 니껴바이오 낫또분말, 서미바이오 화단비분말과 환... ",http://www.viva100.com/main/view.php?key=20200929010006111,http://www.viva100.com/main/view.php?key=20200929010006111,"Tue, 29 Sep 2020 08:56:00 +0900"
대경상사,"대경경자청, 일본 ‘EXPO후쿠오카’ 전시회 참가","이어 대경경자청 홍보부스를 방문한 기업 관계자 중 면담 신청 기업과 16일과 17일 양일간에 걸쳐 온라인 상담회를 개최했다. 금융기관, 소프트웨어 개발업, 종합상사, 운수업체, 개호용품(노인 복지용 전동침대) 제조사와... ",http://tk.newdaily.co.kr/site/data/html/2020/09/21/2020092100250.html,http://tk.newdaily.co.kr/site/data/html/2020/09/21/2020092100250.html,"Tue, 22 Sep 2020 15:44:00 +0900"
M&F,"넷마블 '세븐나이츠2', 출시 3일 만에 리니지2M 제쳤다","구글 플레이 매출 1위 자리는 지난 2017년 6월부터 현재까지 리니지M이 차지하고 있다. 3년 넘게 단 한 차례도 1위 자리를 내 주지 않았는데, 세븐나이츠2가 여세를 몰아 1위를 달성하게 된다면 3년여 만에 1위 주인이... ",http://www.inews24.com/view/1319274,https://news.naver.com/main/read.nhn?mode=LSD&mid=sec&sid1=105&oid=031&aid=0000569653,"Sat, 21 Nov 2020 12:14:00 +0900"
현성푸드,“제주형 푸드트럭 레시피 맛보세요”,[제주=일요신문] 현성식 기자 = 제주산 식재료를 활용해 개발한 제주형 음식메뉴 6가지가 일반 주민들에게... 일대)에서 '제주 푸드포트 페스티발'을 열고 여기서 선보일 ‘제주형 공공레시피'가 결정됐다고 밝혔다.... ,http://ilyo.co.kr/?ac=article_view&entry_id=297579,http://ilyo.co.kr/?ac=article_view&entry_id=297579,"Tue, 15 May 2018 18:10:00 +0900"
중리주조장,"국세청, 기술연구소 설립 100주년…다양한 행사 개최","전남 해남) ▶병영주조장(김견식. 청세주. 전남 강진) ▲추성고을(양대수. 기대주, 대잎술. 전남 담양)... 경남 함양) ▶(주)무학 중리공장(최재호. 가을국화 2종. 경남 마산) ▶경주법주(주)(김동구. 화랑, 경주법주. 경북... ",http://www.taxtimes.co.kr/hous01.htm?r_id=133998,http://www.taxtimes.co.kr/hous01.htm?r_id=133998,"Wed, 28 Oct 2009 20:05:00 +0900"
문경주조,“삼성 갤럭시 스마트폰에 고인돌 문화를 입혀라”,"다뉴세문경을 어떠한 기술로 주조했는지는 현대의 최첨단기술로도 그 비밀을 파헤치기가 쉽지 않을 정도이다. 밀랍주조법, 석제주조법 등 다양한 추측이 난무할 정도로 정교함과 주조기술에 있어서 불가사의한 기록을... ",https://www.chosun.com/economy/economy_general/2020/10/22/H5XEK6FXK5ARFGQVBQ5C7KKEXE/?utm_source=naver&utm_medium=original&utm_campaign=news,https://news.naver.com/main/read.nhn?mode=LSD&mid=sec&sid1=101&oid=023&aid=0003570642,"Thu, 22 Oct 2020 16:34:00 +0900"
농업회사법인우리가,"부여, 해살이농업회사법인 굿뜨래장학금 기탁",굿뜨래 장학금 기탁식(사진제공=부여군) 해살이농업회사법인은 18일 부여군청을 찾아 지역인재 육성을 위한 장학금 100만원을 부여군굿뜨래장학회에 기탁했다. 이호인 대표는 이날 기탁식에서 우리 학생들의 성장이 곧... ,http://www.chungnamilbo.co.kr/news/articleView.html?idxno=572245,http://www.chungnamilbo.co.kr/news/articleView.html?idxno=572245,"Fri, 20 Nov 2020 11:24:00 +0900"
사임당,"[아무튼, 주말] 완모는 일등칸, 완분은 꼬리칸… 산후조리원은 설국열차?",세계 최초 산후조리원의 등장 ‘(산후조리원은) 1996년 10월 (인천 남동구) 만수동에 처음 문을 연 사임당... 당시 사임당 산후조리원장이었던 김계화(58) ㈜사임당홈케어 대표이사는 “사업자 등록을 하려는데... ,https://www.chosun.com/national/weekend/2020/11/21/CO36FJKP5FDETGH3VTXG5CGOTY/?utm_source=naver&utm_medium=referral&utm_campaign=naver-news,https://news.naver.com/main/read.nhn?mode=LSD&mid=sec&sid1=102&oid=023&aid=0003577788,"Sat, 21 Nov 2020 03:07:00 +0900"
안동농업협동조합,밭에 파종·방제·조류 퇴치 ‘척척’…“일손 돕는 ‘농업로봇’ 개발합니다...,"오장석 농업로봇실증센터장은 “밭농사 로봇 플랫폼을 표준화하려면 관련 법 개정이 필요한데, 한국농기계협동조합과 포럼을 구성하는 등 평가 인증 기준 마련을 위해 노력하고 있다”며 “국내의 열악한 밭농사... ",http://news.khan.co.kr/kh_news/khan_art_view.html?artid=202010272103025&code=620115,https://news.naver.com/main/read.nhn?mode=LSD&mid=sec&sid1=102&oid=032&aid=0003039920,"Tue, 27 Oct 2020 21:03:00 +0900"
삼일민속제과,순천 여행-생태 수도 순천에서 젊은 문화를 보다,"*원도심(옥리단길) 맛집 ▶화월당 1927년부터 이 자리에서 제과점을 하고 있다는 화월당은 순천 토박이들... 벌교에서 태어나 순천에서 자란 한창기 선생은 6000여 점의 민속 생활용품을 모으고, 어르신들의 이야기를 구술... ",http://news.mk.co.kr/newsRead.php?year=2018&no=746757,https://news.naver.com/main/read.nhn?mode=LSD&mid=sec&sid1=103&oid=009&aid=0004262419,"Thu, 29 Nov 2018 10:37:00 +0900"
메이드인제주,대기업 추가 허용 제주면세점에 '메이드 인 제주' 못판다?,제주도가 나서서 '메이드 인 제주' 제품의 입점을 제한할 것을 건의한 꼴이다. 도내 소상공인 단체에서도 면세점에서 토산품과 특산품 판매를 떠나 신규 허용 자체가 문제라는 입장을 고수해 왔다. 사단법인 제주도... ,http://www.jejusori.net/news/articleView.html?idxno=318461,http://www.jejusori.net/news/articleView.html?idxno=318461,"Thu, 30 Jul 2020 15:40:00 +0900"
햇살내음,[생활 속 영성 이야기] (44) 야생화는 햇살 따라 움직이지 않는다,"이 바람결을 통해 유년 시절 맡았던 늦가을의 내음과 정경들이 파노라마처럼 지나간다. 나도 모르게 잊혀 가는 삶의 조각난 기억들이, 불어오는 바람결을 통해 떠오르면서 지나온 모든 시간들이 주님의 품 안에서 보호받고... ",https://www.catholictimes.org/article/article_view.php?aid=349572,https://www.catholictimes.org/article/article_view.php?aid=349572,"Wed, 11 Nov 2020 11:22:00 +0900"
농업회사법인동서웰빙,"동서제약웰빙, 유통기한 경과 원료 사용…회수 조치",ⓒ 식품의약품안전처 [프라임경제] 식품의약품안전처(처장 손문기)는 건강기능식품 전문제조업체인 농업회사법인 동서제약웰빙이 유통기한 경과 원료를 사용해 제조한 '닥터큐톡스(Talk’s)' 제품을 판매중단·회수... ,http://www.newsprime.co.kr/news/article.html?no=376110,http://www.newsprime.co.kr/news/article.html?no=376110,"Fri, 26 May 2017 13:52:00 +0900"
의성흑마늘영농조합법인,의성흑마늘 베트남 수출길 올라,= 경북 의성군은 의성흑마늘영농조합법인의 대표 제품인 '원용덕 의성흑마늘'이 지난달 31일 베트남 하이퐁으로 제품 1000상자를(3만달러)를 선적했다고 2일 밝혔다. 지난 2007년 설립된 의성흑마늘영농조합법인의 이... ,http://www.newsis.com/ar_detail/view.html?ar_id=NISX20150902_0010263443&cID=10810&pID=10800,https://news.naver.com/main/read.nhn?mode=LSD&mid=sec&sid1=102&oid=003&aid=0006731535,"Wed, 02 Sep 2015 13:52:00 +0900"
농업회사법인자담,"농식품부, 장기간 방치 농업기술 사업화 적극 추진","또한 미시간벤처캐피탈(주)은 농촌진흥청에서 개발한 기술을 농업회사법인 (주)자담이 기술이전 받아 사업화하는데 필요한 자금을 투자하는 투자협약을 체결했으며 ㈜국순당, 설갱벼광덕작목반, ㈜동성제약과... ",http://www.newsis.com/ar_detail/view.html?ar_id=NISX20130925_0012385246&cID=10401&pID=10400,https://news.naver.com/main/read.nhn?mode=LSD&mid=sec&sid1=101&oid=003&aid=0005392502,"Wed, 25 Sep 2013 11:24:00 +0900"
로진,루친스키 `손등에 로진 듬?X` [MK포토],8회 말에서 마운드에 오른 루친스키가 손등에 로진을 묻히고 있다. 3차전 승리로 시리즈 전적 2-1로 앞선 두산은 4차전 승리를 위해 전력을 다하고 있다. NC는 전날 경기 패배에 설욕하기 위해 총력전을 펼치고 있다.,http://mksports.co.kr/view/2020/1199568/,https://sports.news.naver.com/news.nhn?oid=410&aid=0000744792,"Sat, 21 Nov 2020 17:06:00 +0900"
미성패밀리주식회사,[오늘의 장바구니] 이마트·롯데백화점·한섬·공영쇼핑·하이모 외,토이스토리' '주토피아' '몬스터 주식회사' 등 기존에 인기 있는 아이템들은 물론 새롭게 선보이는 '패트와... 브랜드로 △샘표 △GNC △팔도 △네스카페 △GC녹십자웰빙 △해태제과 △미성패밀리 △마즈 △켈로그... ,http://www.newsprime.co.kr/news/article.html?no=520565,http://www.newsprime.co.kr/news/article.html?no=520565,"Mon, 12 Oct 2020 15:06:00 +0900"
담터에프엔비,"순천소방서, 담터에프엔비 직원 소소심 교육","담터에프엔비 직원 소소심 교육 ⓒ순천소방서 순천소방서(서장 박경수)는 지난 30일 담터에프엔비 직원 40명을 대상으로 소소심(소화기, 소화전, 심폐소생술) 교육을 실시했다고 밝혔다. 이날 교육은 심정지 환자 발생... ",http://fpn119.co.kr/sub_read.html?uid=60714&section=sc102,http://fpn119.co.kr/sub_read.html?uid=60714&section=sc102,"Wed, 31 Aug 2016 11:37:00 +0900"
토호식품,"김왕근 전 농축산식품부 부이사관, 해남군수 출마",[광주CBS  김왕근 전 농림축산식품부 부이사관이 오는 지방선거에서 해남군수에 출마하겠다고 밝혔다. 김 전... 지역의 토호세력에게 맡겨서는 희망이 없다는 결론 이었다고 했다. 이어 몇몇 토호세력들의 오만과... ,http://www.nocutnews.co.kr/news/4935095,https://news.naver.com/main/read.nhn?mode=LSD&mid=sec&sid1=102&oid=079&aid=0003076334,"Wed, 07 Mar 2018 14:21:00 +0900"
신평양조장,어디 쉬면서 배울만한 곳 없나요?,상하농원 1522-3698 # 발효문화를 배우다…당진 신평 양조장 3대째 막걸리 빚은 88년 세월 명인이 들려주는 노동의 철학 충남 당진시 신평 양조장은 일제강점기 1933년 화신 양조장에서 출발했다. 이를 2대 김용세 명인이... ,http://www.munhwa.com/news/view.html?no=2020111901031812048001,https://news.naver.com/main/read.nhn?mode=LSD&mid=sec&sid1=103&oid=021&aid=0002449920,"Thu, 19 Nov 2020 11:20:00 +0900"
도암주조공사,"주류업체, 멘토링 통해 노하우 전수","한편 멘티업체는 하남주조장, 도암주조공사, 점암주조장, 섬진강매화향, 농업회사법인(주)산들, 공산주조장, 농업회사법인(주)죽향도가, 하심당, 몽탄주조장, 새순천양조영농조합법인, 안양주조2공장... ",http://www.bosa.co.kr/umap/sub.asp?news_pk=606083,http://www.bosa.co.kr/umap/sub.asp?news_pk=606083,"Tue, 28 Jun 2016 06:07:00 +0900"
신영에프에스,㈜신영에프에스‘산초분말’판매중단 및 회수 조치,"식품의약품안전처(처장 류영진)는 식품제조가공업체인 가보식품(경기도 남양주시 소재)이 제조하고, 식품소분업체 ㈜신영에프에스(경기도 광주시 소재)가 소분하여 판매한 ‘산초분말’(유형: 천연향신료)... ",http://medicalworldnews.co.kr/news/view.php?idx=1510927473,http://medicalworldnews.co.kr/news/view.php?idx=1510927473,"Thu, 20 Sep 2018 23:40:00 +0900"
길경영농조합법인,이천농협 '고주모' 길경영농조합법인서 도농협동체험,"기호일보, KIHOILBO 이천농협의 여성조직인 고향주부모임(이하 고주모)이 최근 관내 길경영농조합법인을 방문해 도농협동체험을 실시했다. 도농협동체험은 이천농협이 도시 소비자와 농촌 생산자 사이에 교류를 통하여... ",http://www.kihoilbo.co.kr/news/articleView.html?idxno=895156,http://www.kihoilbo.co.kr/news/articleView.html?idxno=895156,"Thu, 05 Nov 2020 16:11:00 +0900"
중앙주조,"'막걸리 초콜릿 마카롱'?...지평주조, 이색 막걸리 레시피 추천",이에 전통 막걸리 제조업체 지평주조가 지평막걸리와 함께 떨어지는 가을 단풍의 아쉬움을 달래며 집콕... 버터크림 중앙 깊숙히 찔러 넣어준 뒤 알록달록 마블 꼬끄로 덮어주면 완성이다. 냉장고에서 하루 이틀 보관한... ,http://www.newsis.com/view/?id=NISX20201113_0001232608&cID=13001&pID=13000,https://news.naver.com/main/read.nhn?mode=LSD&mid=sec&sid1=101&oid=003&aid=0010185019,"Sat, 14 Nov 2020 07:30:00 +0900"
우리의땅과바다,[나홀로 우리 땅 걷기] 인천 둘레길을 아시나요?,"바다와 강, 갯벌을 만나는 길… 총 114.6㎞ 16개 코스 인천에도 둘레길이 있다? 걷기를 좋아하는... 일제강점기에는 우리나라에서 정미된 쌀을 일본으로 반출하는 주요 수단으로 이용되다가 광복 이후에는 소래염전의 소금을... ",http://san.chosun.com/site/data/html_dir/2020/10/26/2020102601012.html?utm_source=naver&utm_medium=original&utm_campaign=san,https://news.naver.com/main/read.nhn?mode=LSD&mid=sec&sid1=103&oid=094&aid=0000008599,"Mon, 16 Nov 2020 09:32:00 +0900"
삼진씨앤에프,서울국제식품산업대전 참가업체 남양주에 소외층 위한 성금 기탁,이번 성금은 2018년 서울국제식품산업대전 참가팀 중 9개 업체인 농업회사법인하늘농가㈜ 나루가온에프앤씨㈜ ㈜대조에프앤비 영동씨푸드㈜ 농업회사법인㈜이삭뜰 ㈜토종마을 ㈜쏘이마루 ㈜삼진씨앤에프... ,http://www.kgnews.co.kr/news/articleView.html?idxno=515481,http://www.kgnews.co.kr/news/articleView.html?idxno=515481,"Thu, 17 May 2018 21:28:00 +0900"
태경식품,"[머니S포토] 중견기업인의날, 샘표식품(주) 금탑산업훈장 수상","이번 기념식은 '연대와 협력으로 한국 경제 재도약을 이끌어 갈 중견기업' 슬로건 아래 정세균 국무총리, 강호갑 중견련 회장을 비롯 김해련 태경그룹 회장, 박진선 샘표식품(주) 대표이사, 김상철 한글과컴퓨터그룹... ",http://moneys.mt.co.kr/news/mwView.php?no=2020111811168082191,https://news.naver.com/main/read.nhn?mode=LSD&mid=sec&sid1=101&oid=417&aid=0000620355,"Wed, 18 Nov 2020 11:19:00 +0900"
태양생활건강,조종사·객실담당 '건강영향평가' 대상 포함 법개정 추진,김철민 의원이 발의할 생활주변방사선 안전관리법 개정안에는 항공운수사업자가 항공승무원을 대상으로 방사선 피해와 관련한 건강 검진을 정기적으로 실시하도록 하는 규정이 명시될 예정이다. 또... ,http://www.kyeongin.com/main/view.php?key=20201108010001412,http://www.kyeongin.com/main/view.php?key=20201108010001412,"Sun, 08 Nov 2020 21:55:00 +0900"
사임당푸드(영),"고창 전통한과 업체 사임당푸드, 미국에 4만달러 수출",특히 시장가능성을 본 바이어가 이번 판촉행사를 통해 고창 사임당푸드(영)(대표 조해주)와 4만달러에 해당하는 수출 계약을 맺었다. 조해주 사임당푸드(영) 대표는 “전통식품인 한과와 떡 제품이 세계인들에게도... ,http://news1.kr/articles/?2830391,https://news.naver.com/main/read.nhn?mode=LSD&mid=sec&sid1=102&oid=421&aid=0002391657,"Mon, 14 Nov 2016 17:10:00 +0900"
